{
  "$schema": "http://json-schema.org/draft-04/schema#",
  "id": "https://www.cbs.tu-darmstadt.de/secureepilink/schemas/local-init-schema.json",
  "definitions": {
    "authentication": {
      "properties": {
        "authType": {"enum": ["none","apiKey"]},
        "additionalProperties": {
          "sharedKey": {"type": "string"}
        }
      },
      "required": ["authType"]
    },
    "field": {
      "properties": {
        "name": {
          "type": "string"
        },
        "frequency": {
          "type": "number"
        },
        "errorRate": {
          "type": "number"
        },
        "comparator": {
          "type": "string",
          "enum": [
            "binary",
            "dice"
          ]
        },
        "fieldType": {
          "enum": [
            "integer",
            "number",
            "string",
            "bitmask"
          ]
        },
        "bitlength": {
          "type": "number"
        }
      },
      "required": ["name", "frequency", "errorRate", "comparator", "fieldType", "bitlength"],
      "additionalProperties": false
    }
  },
  "properties": {
    "localId": {"type": "string"},
    "localAuthentication": {"$ref": "#/definitions/authentication"},
    "dataService": {
      "properties": {
        "url": {"type": "string"}
      },
      "required": ["url"],
      "additionalProperties": false
    },
    "algorithm": {
      "properties": {
        "algoType": {"enum": ["epilink"]},
        "threshold_match": {"type": "number"},
        "threshold_non_match": {"type": "number"},
        "exchangeGroups": {"type": "array"},
        "fields": {"type": "array",
          "items": {"$ref": "#/definitions/field"},
          "additionalItems": false}
      },
      "required": ["algoType", "threshold_match", "threshold_non_match", "exchangeGroups", "fields"],
      "additionalProperties": false
    }
  },
  "additionalProperties": false,
  "required": ["localId", "localAuthentication", "dataService", "algorithm"]
}
