{
"localId": "TUDA2",
"localAuthentication": {
  "authType": "apiKey",
  "sharedKey": "123abc"
},
"dataService": {
  "url": "http://127.0.0.1:8800/Communicator/getAllRecords"
},
"algorithm": {
  "algoType": "epilink",
  "threshold_match": 0.9,
  "threshold_non_match": 0.7,
  "exchangeGroups": [[ "vorname", "nachname", "geburtsname" ]],
  "fields": [
    {
    "name": "vorname",
    "frequency": 0.000235,
    "errorRate": 0.01,
    "comparator": "dice",
    "fieldType": "bitmask",
    "bitlength": 500
    },
    {
    "name": "nachname",
    "frequency": 0.0000271,
    "errorRate": 0.008,
    "comparator": "dice",
    "fieldType": "bitmask",
    "bitlength": 500
    },
    {
    "name": "geburtsname",
    "frequency": 0.0000271,
    "errorRate": 0.008,
    "comparator": "dice",
    "fieldType": "bitmask",
    "bitlength": 500
    },
    {
    "name": "geburtstag",
    "frequency": 0.0333,
    "errorRate": 0.005,
    "comparator": "binary",
    "fieldType": "integer",
    "bitlength": 11

    },
    {
    "name": "geburtsmonat",
    "frequency": 0.0833,
    "errorRate": 0.002,
    "comparator": "binary",
    "fieldType": "integer",
    "bitlength": 11

    },
    {
    "name": "geburtsjahr",
    "frequency": 0.0286,
    "errorRate": 0.004,
    "comparator": "binary",
    "fieldType": "integer",
    "bitlength": 11

    },
    {
    "name": "plz",
    "frequency": 0.01,
    "errorRate": 0.04,
    "comparator": "binary",
    "fieldType": "string",
    "bitlength": 40

    },
    {
    "name": "ort",
    "frequency": 0.01,
    "errorRate": 0.04,
    "comparator": "dice",
    "fieldType": "bitmask",
    "bitlength": 500

    }]
  }
}
